review_dates,review_places,review_ratings,review_authors,review_titles,reviews
" August 16, 2023", United States ,5,NV Rush Fan,Dissolve on the Tongue & Relax!,"These little tablets are very effective. Once in a while I have a really hard time sleeping, and I just dissolve 3 or 4 on my tongue, lie down & relax, and in less than 30 minutes I’m off in dreamland. I try not to take them too often, because I read if you take melatonin too regularly, your body will stop making it naturally. But, for occasional sleeplessness, these tablets are really wonderful."
" August 15, 2023", United States ,5,Amazon Customer,Satisfied Customer,"Everything all okay, keep up the good work."
" August 14, 2023", United States ,5,david tam,Good price!,Good price for quantity!
" August 14, 2023", United States ,5,g sparks,Great,Great price
" August 13, 2023", United States ,1,Linelle Russell,Do not working 😕,Not working 😕
" August 13, 2023", United States ,4,Nervit ball,nice,"Eat down a piece is still effective, but can not eat more, eat too much headache"
" August 12, 2023", United States ,1,baltimore wife,Still Up Counting Sheep!,"I wanted these pills to work, not even yawn. God must want me to get back into prayer warrior position. There is a lot to talk to Him about with the way things are going on in our world today."
" August 11, 2023", United States ,5,JoeB,Really works and dissolves quickly,"I've tried various brands of melatonin and I like this one the best. Good taste, dissolves quickly and is very effective."
" August 9, 2023", United States ,5,Patricia Harden,easily dissolve,"easy to chew or let dissolve in your mouth
pleasant tasting"
" August 7, 2023", United States ,5,cassia silva,A must for a good sleep!,"Perfect flavor, using it every night. Thanks"
" August 6, 2023", United States ,5,ABCDEFGHIJKLMNOPQRSTUVWXYZ,These work well,Take one of these at bedtime and go lay down. Puts you right to sleep. Works well.
" August 6, 2023", United States ,1,Felandria Coles,Increases BP,Increases BP
" August 5, 2023", United States ,5,Julie Wineland,It works,The melatonin works great to take the edge off for my grandkids.
