review_dates,review_places,review_ratings,review_authors,review_titles,reviews
" May 20, 2020", United States ,5,FaithfulShopper,Definitely helps during this UNPRECEDENTED time....,"I am pleasantly surprised by this product. I've been struggling with sorting due to the impact of Covid19. I'm not as active so I'm not sleeping as well. I did lots of research on the benefits of melatonin so I just needed to find the right brand. I went with this brand because it had a high start rating and good reviews... so here's mine:

Taste... like tang.... fake orange flavor, not the best; but not inedible

Dosage...I took advice from a lot of people and decided to start with 5mg ( broke this one in half). Did this for 3 to 4 days and noticed I stayed asleep a little longer. Went up to the full 10mg and went to sleep faster... not knocked out... just eased into it... woke up like clockwork around 630am, refreshed. So I thought I would try 15 mg. Why? Maybe I would go to sleep faster and sleep later. NOPE! I ended waking up every other hour and actually had a dream I could remember.
I've been consistent with 10mg for the past week and it's a good fit. I ease ease into a restful slumber... no more over 😴 and up with a good attitude. My 350lb male friend was knocked out with only 5mg (I'm female, 40, 185 lbs). So I guess it definitely varies with each individual. I say start at 5mg and work up if needed."
" August 6, 2023", United States ,5,ABCDEFGHIJKLMNOPQRSTUVWXYZ,These work well,Take one of these at bedtime and go lay down. Puts you right to sleep. Works well.
" May 28, 2023", United States ,5,Kris10,A great boost to help you sleep!!,These chewable sleep aids are the perfect amount of melatonin to help you fall asleep fast and stay asleep longer. They have a wonderful strawberry flavor and are easy to chew with no aftertaste. I would recommend these small tablets if you're looking for a natural way to aid in sleep.
" June 28, 2023", United States ,5,Amazon Customer Review,Melatonin dissolvable tabs,"Easy to take with pleasant taste. After using two nights scored over 80 per Fitbit, which is good sleep and felt more rested. I have familial advanced sleep phase syndrome, so hope the good results continue"
" May 2, 2023", United States ,4,J. Kirkland,Sleepy Time,The pills work good. But the flavor was not the best.
" August 9, 2023", United States ,5,Patricia Harden,easily dissolve,"easy to chew or let dissolve in your mouth
pleasant tasting"
" July 9, 2022", United States ,5,Amazon Customer,Works great for me,"No guarantees, but it works great for me, and no hangover in the morning. I know people who tell me melatonin doesn't work for them or they feel loopy in the morning. Too bad. I used to be able to get 8 hours of uninterrupted sleep for years, but as I age, my metabolism has changed. My bladder has me having to get up several times in the night to relieve myself, for instance. Before I started taking melatonin, after getting up for the third time, I'd be wide awake and couldn't get back to sleep. With melatonin, this is not a problem - I get back to sleep right away. And like most stuff you buy on Amazon, you get more for less. If you have a problem with sleep, I recommend trying this. I hope it works for you."
" July 29, 2023", United States ,5,Scott,Great product!,"I like the fast dissolving tablets, they taste good and they help me fall asleep faster."
" July 26, 2023", United States ,5,happy buyer,My favorite melatonin,Helps me fall asleep fast and stay asleep! My whole family uses this stuff and we love it.
" August 15, 2023", United States ,5,Amazon Customer,Satisfied Customer,"Everything all okay, keep up the good work."
" January 23, 2023", United States ,5,nemisis,Great sleep aid!,"First of all do not swallow tablet, place one tablet in mouth and let it melt. This is the 5mg tablet my doctor recommended, and he indicated not to take more than 1 tablet each time. I would suggest you contact your doctor if you think you need more than that. I like the fact Melatonin is naturally produced by the human body for sleep. So unless there are any added substances that could be considered harmful, Natrol's Melatonin seems to be safe. Again, for me, my doctor recommended no more than one tablet each time used."
" August 2, 2023", United States ,5,Mr. Stewart,Works Extremely Well!,"Love them! I don't use them often, but when I do, they come in clutch!"
" August 5, 2023", United States ,5,Julie Wineland,It works,The melatonin works great to take the edge off for my grandkids.
" August 7, 2023", United States ,5,cassia silva,A must for a good sleep!,"Perfect flavor, using it every night. Thanks"
" November 14, 2022", United States ,4,grannygeorge,Effective enough,"Bought this product to help me fall asleep faster as I stay up most of the night. They're fairly easy to swallow and have an alright flavor, like a vitamin. They work fine but not instantly or the most much. For severe night owls there may be something better but I'm not sure. But this product work well enough to go to sleep easily after a small amount of time. Worth the money if it works for you."
" June 29, 2023", United States ,5,vallyn henderson,"Glad they make this product, it definily helps getting to sleep",Once in awhile I even take 1 1/2 such good for the seniors
" June 30, 2023", United States ,5,EA,Great product,"Great flavor, dissolves easily and executes on helping me fall asleep quickly"
" January 13, 2024", United States ,5,Fixermun,Melt in your mouth sleep aid,"These melt in your mouth and are absorbed through the membranes in your mouth. I break them in half, and use as needed. The flavor is good."
" January 12, 2024", United States ,5,Jaime,Works great!,"I have a hard time sleeping so I take these pretty regularly. This was my second bottle. For me, it takes a while to kick in so I have to plan ahead and take it so I can be tired at the time I want to go to sleep. Its a good value and the tablets dissolve fast."
" January 11, 2024", United States ,1,Reader903,Didn’t work,First time trying melatonin and unfortunately didn’t work for me. It’s 3:13 am and I’m struggling to go to sleep. I did one dose before bed an another one 2 hours later. I’m so use awake.
" January 10, 2024", United States ,1,Amazon Customer,No SEAL,Unsafe to use supplements with no seal. Has been opened and could be contaminated
" January 10, 2024", United States ,3,william wimberly,Wears off early,"Puts me to sleep pretty quickly, but wears off after about 4 hours. Actually wakes me up when it does."
" January 10, 2024", United States ,5,TheSHABANIMAL,Natrol Melatonin 5mg: A Five-Star Sleep Upgrade That Surpasses Expectations,"Having been a loyal user of the NOW melatonin brand for over a decade, I was hesitant to switch, but trying Natrol Melatonin 5mg has been a revelation, earning it a well-deserved five-star rating.

From the first night, I noticed a significant improvement in the quality of my sleep – a peaceful and restful experience that I hadn't realized was missing. Initially skeptical, I attributed it to a possible fluke, but after consistently using Natrol Melatonin for two bottles now, I can confidently say it's no accident.

The effectiveness of Natrol Melatonin is consistent and reliable, making it an essential part of my nighttime routine. The transition from my previous brand has been seamless, and the positive impact on my sleep has been undeniable.

I wholeheartedly recommend the Natrol Melatonin 5mg to anyone seeking a reliable and effective sleep aid. It has surpassed my expectations, providing the serene and restorative sleep I've been longing for. In my book, it's a five-star game-changer!"
" January 6, 2024", United States ,4,Placeholder,Works like it should,Taste is okay no after effects
" January 6, 2024", United States ,5,Arlyn Almeida Aparicio,Sweet taste,Helps me sleep like a baby
" January 5, 2024", United States ,5,barbara,It helps me sleep,Sleeping
" January 5, 2024", United States ,5,Miriam D. Franklin,Melatonin,This always helps me fall asleep. It tastes good too
" January 4, 2024", United States ,5,Crystal S,better than others,"I originally purchased these because I wanted a dissolving pill that did not contain red-40 in the ingredients. I have found a few other brands that don't have red-40 but this one is the best tasting one I have tried so far. (it's a bit more expensive, but I think its worth it)"
" January 4, 2024", United States ,5,J Kaz,Works,5MG
" January 3, 2024", United States ,1,yellowboy,"The majority of the pills are broken into pieces. How do,you know how much you are taken.",Pills broken. Can’t tell what or how much you are taking. Supposed to be 200 tablets. I doubt 100. A believe a refund and new bottle should be sent
" December 30, 2023", United States ,1,Maro,I got the garbage instead of sleeping pills,"When I opened a bottle of pills, a small explosion occurred like a cracker, some dust, apparently part of the pills, flew out there, I do not want to use such tablets that explode"
" December 28, 2023", United States ,5,Pamela Teixeira,Sleeping,These work well
" December 28, 2023", United States ,5,Betty,Works like a charm!,I have tried many other brands and always come back to this one! Dissolve under tongue and feel sleepy around 25 minutes later. Tastes fine and I highly recommend. Side note… have had occasions where I needed to change course and stay awake and was able to push through without a ton of drowsiness. Conclusion when you start to feel sleepy shut it down and let it do its job.
" December 25, 2023", United States ,5,Sarah,Best sleep ever,"I slept like a baby. Great taste, they dissolve in your mouth so no swallowing pills. Brings a lot of them for the price!! Worth it!"
" December 22, 2023", United States ,1,Ricardo Tan Jr.,not working!,I have been using the brand Natrol for melatonin fix. this is a bust - totally does not work.
" December 20, 2023", United States ,1,Anon,Doesn't help me,I used as directed and saw no improvement for a little over a week. I even went up on the dosage by taking 2 and still saw no improvement. Still woke up in the night and could not go back to sleep. Still had trouble going to bed.
" December 16, 2023", United States ,5,JERELD MILLER,Melatonin,Love this dosage and flavor.
" December 15, 2023", United States ,5,Elizabeth A. Ruark,Effective,Came in great condition. Works well.
" December 14, 2023", United States ,5,Laurie,They do the trick!,Hubby didn't want to take sleep meds because he's taking plenty of meds already. His sleep specialist suggested using these instead and they've been working quite well.
" December 14, 2023", United States ,5,Denise Chechele,Easy to order,Seamless order and delivery - already knew the product is fantastic
" December 13, 2023", United States ,5,Jimena Gallegos,Natrol Melatonina 5 mg,Justo lo que pedí
" December 13, 2023", United States ,5,Beau & Megan Bergmann,Great product,"Good flavor, nice size"
" December 11, 2023", United States ,5,J. Foust,Best Melatonin I've tried!,"I've been taking these dissolvable melatonin tablets for about a year now and I love them! They dissolve fast and taste great. I usually take one about an hour before bedtime, and sleep so much better than I used to. I was a very restless sleeper that would sometimes take hours to fall asleep, but thanks to melatonin I fall asleep easily and get a good restful night's sleep. My one small issue with them is that I wake up a little groggier than usual, but I can usually shake that off after a few minutes."
" December 10, 2023", United States ,5,Kelly H Maise,Quanity & Price,I Have Forgotten Hiw Much I Missed These!! They Work Exceptionally Well!!
" December 10, 2023", United States ,5,Amazon Customer,great price,works like other melatonin and cost less than most melatonin
" December 9, 2023", United States ,2,lauren,Check expiration date before opening.,"I received this bottle of 200 melatonin tablets today, December 8, and they expire on March 31 of this upcoming year. How am I supposed to use 200 tablets in 112 days? Unfortunately I opened it before I noticed."
" December 7, 2023", United States ,1,Jose R Aragon Jr,CONTAINS XYLITOL!,"DO NOT GIVE TO DOGS! This product contains xylitol, in fact, it's the first listed ingredient. Found out the hard way."
" December 6, 2023", United States ,5,Ángela Murcia,Best one!,This is the best brand I’ve tried. I have one every night and it works pretty fast
" December 5, 2023", United States ,5,A. Mahgoub,Good Quality,good product ssolves easily
" December 2, 2023", United States ,5,Kate Maxwell,"Safe, Easy, Effective","The strawberry flavor, fast dissolving tablet is ideal for me. As a senior, it's vital that any sleep aid does not have side effects, as prescription meds may, that would put me at risk of falling when I need to get up to go to the bathroom in the middle of the night."
" December 2, 2023", United States ,5,Isabelle,Works and yummy,I break this in half and is all that I need whenever I can’t fall asleep. Sometimes I give like 1.25mg of it to my kids when they won’t sleep either and works like a charm. I didn’t have any side effects like headache etc as they said about taking melatonin.. this is the first I ever took this supplement and The first night I had half of the tablet it worked immediately.
" December 1, 2023", United States ,5,Ana,The only great fast acting Melatonin IMO,The best there is for fast acting dissolvable melatonin in the market!
" November 29, 2023", United States ,5,C Love,Sweet Dreams in a Flash,"My go-to solution for fast and efficient sleep aid. The quick-dissolve feature lives up to its name, providing a swift and effective way to prepare for a restful night. One of the standout features for me is the strawberry flavor. It is pleasant for adults, but it's also for kids. The enjoyable taste eliminates the struggle of convincing little ones to take it, turning bedtime into a smoother and more enjoyable routine.
."
" November 27, 2023", United States ,5,That guy,Just Perfect for Me,"This 5mg dosage of melatonin is perfect for me and Natrol is a high-quality brand I've been using for years.

It's not always easy to find 5mg melatonin. 10mg is a little too much for me and I wake up a little groggy. This dosage, brand and price point is perfect for me and I'll definitely re-order!"
" November 27, 2023", United States ,1,Javier,It makes me dizzy,This product makes me dizzy. I tried a few times and the result was the same. I’ve used another brand of Melatonin and never had this problem.
" November 27, 2023", United States ,5,Anthony L. Stashak,Excellent product,Night time sleep helper!
" November 25, 2023", United States ,5,JoAn,They disolve in your mouth. They are great,I like the strawberry taste.
" November 19, 2023", United States ,1,Anton,Doesnt work. Do not buy!,"It doesn't work. It seems to be a placebo, just a sugar candy. It doesn't help with sleep whatsoever. Skip it and look for a different brand."
" November 12, 2023", United States ,5,Lorena,Excelente,Buenísima y eficaz para adultos ayuda a conciliar sueño más rápido.
" November 11, 2023", United States ,5,LIDOBADABRA,Only one brand I rely on,"It’s melting while still in my mouth, that’s how I know it will be absorbed fast. And like many melatonin users I confirm, melatonin is not going to make you fall asleep faster. But the safe nightly routine will. After I’m already in bed and ready to spend 20 mins on my phone, I pop one or two in and bam, brain is signaled. I will be far calmer and ready to switch off for the day."
" November 9, 2023", United States ,5,Jenelson,I will sleep tonight,Helps me sleep
" November 9, 2023", United States ,5,Mimi and Gaga,Perfect,Perfect
" November 5, 2023", United States ,4,monica pieroni,Better than other brands,I like this brand better than others. I feel as if this brand works better. The dissolve and taste good
" October 30, 2023", United States ,5,Phyllis Weaver,I love this product,I have used this for years. It also helps me tell which of 13 medications are which. A few look identical. Will buy again.
" October 28, 2023", United States ,1,jack,It didn't work for me,I got strong migraine
" October 27, 2023", United States ,5,Shalom,Good Quality Product👍🏻,"I get these Melatonin 5mg Strawberry-Flavored Supplements for Restful Sleep via Amazon’s Sub/Save every other month & am really happy with them. The quality is really good. They work really well for my family & me plus they taste really good. Strawberry is my favorite fruit so I have No problem taking these. Am happy with the results too. They have helped us with drifting off &/or staying asleep. Important when you have issues with sleeping.

Recommend…👍🏻

❤️‍🔥Shalom…"
" October 23, 2023", United States ,5,Teresa M,Works well,This product is perfect if you have trouble sleeping. No grogginess in the morning.
" October 19, 2023", United States ,5,CdA Ringleader,Best tasting chewable,I’ve been using this brand for years. The effect is consistent and I sleep well using it
" October 16, 2023", United States ,5,Mark Lyle,Top Shelf,Puts me to sleep in less than a hour
" October 14, 2023", United States ,5,Jdlco,Great value!,Love the quick dissolve and better priced here than Walmart.
" October 14, 2023", United States ,5,Dale G,Excellent,Better price than COSTCO
" October 9, 2023", United States ,5,Tarena,Non addicting,I love this product. Peaceful night sleep
" October 9, 2023", United States ,3,Amazon Customer,Asleep fast but...,This is a good product to get to sleep fast but doesn't keep me asleep for over 4 hours. I found the extended release works better for me and I sleep all night.
" October 8, 2023", United States ,1,sammy,DIFFERENT FORMULA? STOPPED WORKING.,"Play Video
 As of September 2023, THIS PRODUCT NO LONGER WORKS.

I have been taking Natrol Melatonin for 5 years. They recently changed the label slightly, and reduced the serving count from 250 to 200…but the worst part is it went from being 100% to 0% effective for me and two of my family members.

It is not kicking in before bed, or in the middle of the night when I wake up and take it. My girlfriend concurs.

It isn’t just me saying this, but my father, who separately subscribes to this product at a different address, concurs. It is not the same as it used to be.

Something may be wrong with the recent manufacturing of this product. I hope they figure it out."
" October 4, 2023", United States ,5,George H. Jones,Best Melatonin product I have ever used.,"This is a product that you really should dissolve under your tongue. I takes about 10-15 minutes to work, then you feel ready to sleep! I generally sleep through the entire night!
ps- It tastes great!"
" October 1, 2023", United States ,5,trishainseattle,great product,worked well!
" October 1, 2023", United States ,4,J. Davis,Good product but sometimes damaged,"I’ve been buying this brand melatonin product for quite awhile. It’s a good product, but every once in a while I get a bottle that has a more than acceptable amount that is broken into small pieces. Fortunately, it doesn’t happen too often."
" September 26, 2023", United States ,3,lore,Nightmares,I usually use melatonin but this one gave really bad nightmares So I going to try the Amazon brand and see what happens
" September 23, 2023", United States ,1,C phillips,THIS NOW HAS WHEAT NO LONGER GLUTEN FREE BEWARE CELIACS,"So I bought this thinking I was safe like usual since the last bottle says it does not have wheat or gluten!

Got this bottle and see it now contains wheat. You’re going to get people sick.

This is now useless and a waste of money and time for me I’m going to have to find a different brand."
" September 22, 2023", United States ,5,Erin,Regular purchase,We purchase this regularly in my house and take some nightly. It really helps to calm the mind and allow for a restful sleep. The taste is pleasant and the price is reasonable - no complaints here.
" September 18, 2023", United States ,4,A customer,Melatonin 5 milligrams,Label has no USP.
" September 18, 2023", United States ,4,Kindle Customer,Taste is not great but works very well,Works very well for myself and my 9yo however they hate the taste so much they won’t take it as often as past ones I have purchased
" September 16, 2023", United States ,5,gar-man,Helps my mother sleep,Small doses allows us to increase or decrease dosage for my mother to adjust to her needs.
" September 14, 2023", United States ,5,Priscila,Arrived with security seal,Fast delivery and with security seal
" September 12, 2023", United States ,5,D. Dickerson,These tablets dissolve easily in my mouth.,I love that they dissolve so easily. The flavor is good. There a good value for the money.
" September 12, 2023", United States ,5,Kimberly P.,Works Great,I love this product and have used for a very long time to help me get to sleep . The taste is nice and my grandchildren will even take a small portion of 1 tablet so the taste is kid approved as well & it helps them off to sleep fairly quickly.
" September 11, 2023", United States ,5,Marzia,My favorite 😍,This is one of my family's favorite melatonins. They taste delicious and work well for all of us. Recommended.
" September 8, 2023", United States ,1,Patricia Colbeth,Caution,"After using this product I noticed I became extremely itchy and broke out into an allergic reaction, I experienced restlessness, and struggled to sleep. I’ve used other melatonin products without any of these issues before but noticed this product contains far more additives than the ones I usually take. I will not be using these again and encourage everyone to read through the list of ingredients and consider choosing a different product to avoid these very uncomfortable side effects."
" September 7, 2023", United States ,4,Site7000,New formula?,"I've ordered this product 12 times going back several years. The bottle I just received seems to have a new formulation. It dissolves much more slowly and the flavor is reduced. I'm not sure I like it, but it's not the end of the world. I've tried competitors and I really disliked their flavor, so I'll probably stick with this one."
" September 4, 2023", United States ,5,Carol Mccoy,Use periodically,I use Melatonin periodically when I have a difficult times relaxing and going to sleep. It works.
" September 4, 2023", United States ,5,Margaret Anderson,Nothing,Husband uses them every night
" September 4, 2023", United States ,5,Jules98,Love the 5mg tabs,I take this every night. Been a lifesaver to help me stay asleep.
" September 3, 2023", United States ,5,SouthernGal,Can’t live without these !,I work night shift 5 nights a week 12 hours . I usually take 4 to 6 tabs and get a full days sleep to prepare me for an entire shift . I highly recommend these to anyone having trouble sleeping . 🤷‍♀️
" September 2, 2023", United States ,4,michele jack,Great deal.,Really like the way that melt in your mouth and they don't taste icky or leave your mouth chalky
" August 30, 2023", United States ,4,Christy,Contains xylitol,Beware of this product as it contains xylitol which is fatal even in small amounts to dogs and can be toxic to cats as well. I will no longer be buying this brand in the future but will opt for something unsweetened or differently sweetened. Every time I take one I worry my curious dog is going to to gobble one up if I drop it. Not worth the worry. There are so many other sugar alcohols—or even a small amount of real sugar—that could be used instead. Not sure why xylitol.
" August 29, 2023", United States ,2,Sam,Only works for a few weeks,"I suffer from intense insomnia, So I obviously bought these so I can freaking sleep and not lose half day used it once knocked me used it twice knocked me out again but only for like two weeks it helped me sleep now when I took it it made me sleep but I would wake up at like 12 or 2pm ?? So like it didn’t last 💀 then it didn’t just work at all so I’m guessing it’s duds cause it’s “all natural with no drugs” I rather drink NyQuil then to take these again 🙄"
" August 28, 2023", United States ,5,Dee,Works great,"Non habit forming, easy dissolve, acts fast, no groggy feeling in the morning"
" August 28, 2023", United States ,5,Matt,Good product,What’s not to love? Fast dissolve. Good taste. Great nights sleep.
" August 27, 2023", United States ,5,david iverson,Highly recommended!,"Very good communication, fast shipment, highly recommended!"
" August 24, 2023", United States ,5,Donna Cole,Just love this! Thank you for a wonderful Amazon purchase! Amazing product!!,Just love this! Thank you for a wonderful Amazon purchase!
" August 24, 2023", United States ,5,Tomasita Davis,That it's effective!!,Sleep 😴
" August 23, 2023", United States ,4,Kat20,Works well,"I had clinical insomnia last fall and winter. My doctor recommended I use REMFresh. I tried it and it worked really well. However, the price skyrocketed to $75 and more.
The reviews for this melatonin product were very promising, but I am a skeptic….
I am very happy with this product. I don’t sleep quite as deep as I did with the other, but I do return to a comfortable sleep easily when I have to get up during the night. Fortunately, it doesn’t leave me thick headed in the morning.
I would highly recommend this product. Monetarily there’s no contest. Effectiveness is wonderful.
I hope you get great results, too."
" August 22, 2023", United States ,5,Sammie,Rest,Great disolving berry flavor and sleep through the night. Wake up feeling rested.
" August 17, 2023", United States ,5,Timothy D. Miller,When you need a natural sleep remedy,"I drive a truck and need my sleep. I use the melatonin to get much needed sleep. They are easy to swallow, don’t leave an after taste. Work great. Good price.
I would highly recommend melatonin to customers"
